{
  "schemaVersion": 1,
  "id": "skill_fixture_extended",
  "name": "fixture-extended",
  "displayName": "codexus:fixture-extended",
  "status": "proposed",
  "version": "0.1.0",
  "sourceRunIds": ["run_fixture"],
  "trigger": {
    "keywords": ["skill", "file", "shell", "interruption"],
    "pathGlobs": []
  },
  "scope": {
    "allowedTaskShapes": ["bugfix", "feature", "verification"],
    "excludedTaskShapes": []
  },
  "procedure": [
    "Run required verification before claiming completion.",
    "When using a skill path, inspect the source and keep retrieved context explicit.",
    "For a file tool roundtrip, inspect the file, apply a scoped edit, and verify the resulting diff.",
    "For shell output summary, keep the critical failing stderr and avoid hiding failures.",
    "For interruption recovery, restore pending state and rerun verification before completion."
  ],
  "safety": {
    "requiresVerification": true,
    "forbiddenActions": [
      "auto-inject retrieved context",
      "overwrite unrelated changes",
      "hide failing stderr",
      "drop pending verification"
    ]
  },
  "promotion": {
    "requiredReplayStatus": "passed",
    "reviewedBy": null,
    "promotedAt": null
  }
}
